{
    "schema_version":  "1.0",
    "plan_package_id":  "task-spec-20260923-1550-prep-material-report-r01",
    "spec":  {
                 "spec_id":  "task-spec-20260923-1550-prep-material-report",
                 "revision":  1,
                 "path":  null,
                 "sha256":  null,
                 "project_id":  "http://10.10.80.231:8052/hjh1126123/wms",
                 "evidence_baseline":  "Git worktree .claude/worktree/prep-material-report @ branch feature/lyp/prep-material-report, HEAD 3a59b94fc08323eb4ed161b786121fec3c37482f（工作区干净，仅 1 个未跟踪的 knowledge-feedback 候选目录）；需求源 C:/Users/liyanpeng/Desktop/doc/仓库备料综合报表/仓库备料综合报表.xlsx（30,906 B，含 xl/media/image1.png 内嵌截图）；本轮全部代码事实取自该 worktree。"
             },
    "package_revision":  1,
    "status":  "READY_FOR_APPROVAL",
    "created_at":  "2026-09-23T07:50:02.0000000Z",
    "request_slug":  "prep-material-report",
    "folder_name":  "20260923-prep-material-report",
    "project_root":  "D:\\Project\\WMS\\.claude\\worktree\\prep-material-report",
    "package_root":  "C:\\Users\\liyanpeng\\.claude\\skills\\task-spec\\20260923-prep-material-report\\r01",
    "package_path":  "C:\\Users\\liyanpeng\\.claude\\skills\\task-spec\\20260923-prep-material-report\\r01",
    "supersedes":  null,
    "source_proposal_sha256":  "1fa52c3d8bd203c73942bddb4dc8a05d5a15e585adefcc2cfb03f19104f159c7",
    "title":  "仓库备料综合报表（拣料单维度）",
    "description":  "新增「仓库备料综合报表」页面与导出：以拣料单为基础数据，把 T100 单头备注按 + 分段解析还原为业务字段，并横向拼装备料、转运、领料确认、回单登记四段数据，输出 A–W 共 18 列。",
    "summary":  {
                    "goal":  "新增「仓库备料综合报表」列表页 + Excel 导出，一行对应一个由用户确认的统计粒度，展示 A–W 中 18 个可见列，其中 7 列来自 T100 单头备注的 + 分段解析。",
                    "problem":  "需求只存在于一张 Excel 的取数说明与一张 T100 截图里：4 处段位说明自相矛盾；系统内不存在「模组名称」字段；备料/转运/领料确认/回单登记四段数据分散在 8 张以上表，且「转运」在代码里有三套并存载体。",
                    "value":  "让 PC 与仓管在一个页面看完备料全链路，替代当前人工把 WMS 数据与 T100 备注对回 Excel 的做法。",
                    "complexity":  "L3 — 跨后端 Services.Report / Application.Report、前端 AdminUI 页面与菜单 SQL 四层，新增查询契约与导出契约，并引入一条由人工填单习惯决定的数据口径规则。若采纳「同步层物化解析记录表」方向，则升级为 L4（含迁移、回填、对账与不可逆 DDL）。",
                    "status":  "DRAFT"
                },
    "current_state":  {
                          "facts":  [
                                        {
                                            "id":  "F-01",
                                            "title":  "参考报表实现三件套",
                                            "evidence":  "IMTC.WMS.AdminWebApi/Services/Services.Report/Services/Implementations/OutStockOrderReportService.cs:9",
                                            "observation":  "OutStockOrderReportService : IOutStockOrderReportService, ITransient，仅注入 ICachingService 与 IReportDbScopeProvider 两个依赖。"
                                        },
                                        {
                                            "id":  "F-02",
                                            "title":  "参考报表分页入口",
                                            "evidence":  "OutStockOrderReportService.cs:30-49",
                                            "observation":  "GetOrderReportPagedDataAsync：:32 queryDto.Adapt\u003c\u003e()，:35 BuilderMainQuery，:36 ToPageAsync，:38 FillOrderDataAsync。"
                                        },
                                        {
                                            "id":  "F-03",
                                            "title":  "参考报表无显式排序",
                                            "evidence":  "OutStockOrderReportService.cs:136-238；Domain/Domain.Shared/Extensions/QueryableExtension.cs:37-48；Query/PagerQuery.cs:37",
                                            "observation":  "出库综合报表主查询未写 ORDER BY，分页顺序不稳定。属既有缺陷，不应在新报表复刻。"
                                        },
                                        {
                                            "id":  "F-04",
                                            "title":  "参考报表导出与门禁",
                                            "evidence":  "OutStockOrderReportService.cs:54-77、:82-96；Services.Report/Services/ReportQueryPolicy.cs:9、:21、:24",
                                            "observation":  "导出按用户加锁 + CountAsync 上限校验 + 游标分批（ExportMaxRows=500000，ExportBatchSize=100000）；查询时间跨度上限 MaxQueryMonths=3。"
                                        },
                                        {
                                            "id":  "F-05",
                                            "title":  "参考报表控制器与权限",
                                            "evidence":  "IMTC.WMS.AdminWebApi/Application/Application.Report/Controllers/OutStockReportController.cs:6、:35-40、:45-51",
                                            "observation":  "[Route(\"report/outstock\")]，order/page 与 order/export 两个 HttpGet；导出返回 Success(new { path = \"/export/\" + fileName, fileName })。该 Controllers 目录下无任何权限特性。"
                                        },
                                        {
                                            "id":  "F-06",
                                            "title":  "路由族存在两套并存风格",
                                            "evidence":  "OutStockReportController.cs:6 vs OutStockShipmentReportController.cs:6、:27、:40、:52",
                                            "observation":  "旧族 report/\u003cdomain\u003e/{subtype}/{page|export} 与新族 reports/\u003ckebab\u003e/{query|export|enums} 并存；ReceiptReportController.cs:41 是第三种返回 File 字节流的写法。"
                                        },
                                        {
                                            "id":  "F-07",
                                            "title":  "前端页面与菜单的强耦合",
                                            "evidence":  "IMTC.WMS.AdminUI/src/views/reports/outstock-order-report/index.vue:41-43；src/store/modules/permission.js:12、:74、:111-120",
                                            "observation":  "defineOptions({ name: \u0027reports/outstock-order-report/index\u0027 }) 必须与 sys_menu.Component 完全一致，动态路由靠 import.meta.glob + loadView 解析。"
                                        },
                                        {
                                            "id":  "F-08",
                                            "title":  "前端导出下载契约",
                                            "evidence":  "IMTC.WMS.AdminUI/src/views/reports/outstock-order-report/index.vue:78-93",
                                            "observation":  "download(res.data.path, { name: res.data.fileName, hasBase: true, target: \u0027report\u0027 })。"
                                        },
                                        {
                                            "id":  "F-09",
                                            "title":  "菜单 SQL 契约",
                                            "evidence":  "sql/publish/v1.3.8.3/2026-09-21_add_outstock_difference_pick_report_menu.sql；同目录 2026-09-15_add_outstock_shipment_report_menu.sql",
                                            "observation":  "只插入 1 行 sys_menu（MenuType=\u0027C\u0027，Perms=\u0027\u0027，Icon=\u0027table\u0027，IsCache=\u00270\u0027，Visible=\u00270\u0027，Status=\u00270\u0027，IsDeleted=0）；父锚点 MenuType=\u0027M\u0027 AND MenuName IN (\u0027报表管理\u0027,\u0027报表\u0027) 且 COUNT(*)=1，否则 NULL 失败关闭；OrderNum=MAX+1；Path==Component；无 F 按钮行、无 sys_role_menu 写入。"
                                        },
                                        {
                                            "id":  "F-10",
                                            "title":  "拣料单主表关键字段",
                                            "evidence":  "IMTC.WMS.AdminWebApi/Domain/Domain.Warehouse/Entities/OutStock/OutStockPickOrder.cs:17、:43、:58、:205、:212、:230",
                                            "observation":  "OutStockPickOrder（outstock_pick_order）：SyncCode=T100 单号，DeliveryId=出库单 Id，PickOverTime=备料完成时间，HandOverTime=领料完成时间，T100Remark=T100 备注。"
                                        },
                                        {
                                            "id":  "F-11",
                                            "title":  "拣料明细有真字段，无需截取备注",
                                            "evidence":  "OutStockPickOrderDetail.cs:18、:46、:84、:248、:254、:269",
                                            "observation":  "outstock_pick_order_detail 上 SyncCode、ProjectNo、ModuleNo（作业编码/模组号）、BatchNo、PickUser（拣料人）均为真实列；ProjectNo/ModuleNo 在 detail_piece 与 label 上也有冗余真字段。"
                                        },
                                        {
                                            "id":  "F-12",
                                            "title":  "系统内不存在「模组名称」字段",
                                            "evidence":  "全仓 Grep 模组名称|ModuleName 后：仅命中 LowCode 元数据 GenTable.cs:52",
                                            "observation":  "有界搜索后未找到任何业务「模组名称」字段或主数据表。该列只能来自备注解析。"
                                        },
                                        {
                                            "id":  "F-13",
                                            "title":  "备料人现网一律英文逗号拼接",
                                            "evidence":  "OutStockOrderReportService.cs:409；OutStockDifferencePickReportService.cs:462；OutStockDetailReportService.cs:523；OutStockShipmentReportService.cs:399-412",
                                            "observation":  "多值字段统一使用 string.Join(\",\", …Distinct())；全仓未发现用分号拼接备料人的写法。"
                                        },
                                        {
                                            "id":  "F-14",
                                            "title":  "备料人/领料人来源字段",
                                            "evidence":  "OutStockPickOrderDetail.cs:269；OutStockReceiveDetail.cs:256、:263；OutStockOrderReportService.cs:416-421",
                                            "observation":  "备料人=明细 PickUser；领料确认完成时间=outstock_receive_detail.ReceiveOverTime，领料人=ReceiveUser；报表侧口径为 Max(ReceiveOverTime) + ReceiveUser 去重拼接。"
                                        },